chunk_id,chunk_config,ticker,year,section_id,source_type,non_retrievable_reason,text_preview
META_2025_META_Meta_2025_10K_2d479b16_fixed_256_fixed_0288,fixed_256,META,2025,Mixed,fixed,table_of_contents,"income and market value of our cash equivalents, marketable debt securities, and the fair value of our long-term debt. Our cash, cash equivalents, and marketable debt securities consist of cash, time deposits, money market funds, U.S. gover"
META_2025_META_Meta_2025_10K_2d479b16_fixed_256_fixed_0290,fixed_256,META,2025,Mixed,fixed,table_of_contents,for changes in fair value resulting from observable transactions for identical or similar securities of the same issuer. Valuations of our non-marketable equity investments are complex due to the lack of readily available market data and ob
META_2025_META_Meta_2025_10K_2d479b16_fixed_256_fixed_0291,fixed_256,META,2025,Mixed,fixed,table_of_contents,"Item 7, ""Management’s Discussion and Analysis of Financial Conditions and Results of Operations — Critical Accounting Estimates"" contained in this Annual Report on Form 10-K. 81 Table of Contents Item 8. Financial Statements and Supplementa"
META_2025_META_Meta_2025_10K_2d479b16_fixed_256_fixed_0293,fixed_256,META,2025,Mixed,fixed,table_of_contents,"the PCAOB. Those standards require that we plan and perform the audit to obtain reasonable assurance about whether the financial statements are free of material misstatement, whether due to error or fraud. Our audits included performing pro"
META_2025_META_Meta_2025_10K_2d479b16_fixed_256_fixed_0294,fixed_256,META,2025,Mixed,fixed,table_of_contents,"on the consolidated financial statements, taken as a whole, and we are not, by communicating the critical audit matters below, providing separate opinions on the critical audit matters or on the accounts or disclosures to which they relate."
META_2025_META_Meta_2025_10K_2d479b16_fixed_256_fixed_0295,fixed_256,META,2025,Mixed,fixed,table_of_contents,"such losses. How We Addressed the Matter in Our Audit We obtained an understanding, evaluated the design and tested the operating effectiveness of controls over the identification, evaluation and disclosure of loss contingencies, including "
META_2025_META_Meta_2025_10K_2d479b16_fixed_256_fixed_0297,fixed_256,META,2025,Mixed,fixed,table_of_contents,"other third-party advice obtained by the Company, and requesting and receiving confirmation letters from third-party advisors. We also used our knowledge of, and experience with, the application of international and local income tax laws by"
META_2025_META_Meta_2025_10K_2d479b16_fixed_256_fixed_0299,fixed_256,META,2025,Mixed,fixed,table_of_contents,"Venture. We audited the Company’s determination of the primary beneficiary of the VIE, including its determination of the activities that most significantly affect the Venture’s economic performance and assessing which party has the power t"
META_2025_META_Meta_2025_10K_2d479b16_fixed_256_fixed_0302,fixed_256,META,2025,Mixed,fixed,table_of_contents,"authorizations of management and directors of the company; and (3) provide reasonable assurance regarding prevention or timely detection of unauthorized acquisition, use, or disposition of the company's assets that could have a material eff"
META_2025_META_Meta_2025_10K_2d479b16_fixed_256_fixed_0303,fixed_256,META,2025,Mixed,fixed,table_of_contents,"equity Current liabilities: Accounts payable $ 8,894 $ 7,687 Operating lease liabilities, current 2,213 1,942 Accrued expenses and other current liabilities 30,729 23,967 Total current liabilities 41,836 33,596 Operating lease liabilities, "
META_2025_META_Meta_2025_10K_2d479b16_fixed_256_fixed_0304,fixed_256,META,2025,Mixed,fixed,table_of_contents,"57,372 43,873 38,483 Marketing and sales 11,991 11,347 12,301 General and administrative 12,152 9,740 11,408 Total costs and expenses 117,690 95,121 88,151 Income from operations 83,276 69,380 46,751 Interest and other income, net 2,656 1,2"
META_2025_META_Meta_2025_10K_2d479b16_fixed_256_fixed_0306,fixed_256,META,2025,Mixed,fixed,table_of_contents,") — — — ( 29,754 ) ( 29,754 ) Dividends and dividend equivalents declared (1) — — — — ( 5,121 ) ( 5,121 ) Other — — 6 — — 6 Balances at December 31, 2024 2,534 — 83,228 ( 3,097 ) 102,506 182,637 Net income — — — — 60,458 60,458 Other compre"
META_2025_META_Meta_2025_10K_2d479b16_fixed_256_fixed_0309,fixed_256,META,2025,Mixed,fixed,table_of_contents,"113 Net increase (decrease) in cash, cash equivalents, and restricted cash equivalents ( 6,338 ) 2,611 27,231 Cash, cash equivalents, and restricted cash equivalents at beginning of the period 45,438 42,827 15,596 Cash, cash equivalents, an"
META_2025_META_Meta_2025_10K_2d479b16_fixed_256_fixed_0310,fixed_256,META,2025,Mixed,fixed,table_of_contents,"$ 4,105 Acquisition of businesses and intangible assets in accounts payable, accrued expenses and other current liabilities, and other liabilities $ 2,659 $ 172 $ 119 See Accompanying Notes to Consolidated Financial Statements. 93 Table of "
META_2025_META_Meta_2025_10K_2d479b16_fixed_256_fixed_0312,fixed_256,META,2025,Mixed,fixed,table_of_contents,"January 1, 2025. Based on the servers and network assets placed in service as of December 31, 2024, the financial impact of this change in estimate included a reduction in depreciation expense of $ 2.92 billion and an increase in net income"
META_2025_META_Meta_2025_10K_2d479b16_fixed_256_fixed_0313,fixed_256,META,2025,Mixed,fixed,table_of_contents,"by displaying ad products on Facebook, Instagram, Messenger, and third-party mobile applications. Marketers pay for ad products either directly or through their relationships with advertising agencies or resellers, based on the number of im"
META_2025_META_Meta_2025_10K_2d479b16_fixed_256_fixed_0316,fixed_256,META,2025,Mixed,fixed,table_of_contents,"costs that meet the criteria for capitalization were not material to date. For licensed music, we expense the license fees over the contractual license period. We pay fees to music partners based on revenue generated, minimum guaranteed fee"
META_2025_META_Meta_2025_10K_2d479b16_fixed_256_fixed_0319,fixed_256,META,2025,Mixed,fixed,table_of_contents,"on our consolidated statements of income. We incurred advertising expenses of $ 2.09 billion, $ 2.06 billion, and $ 2.02 billion for the years ended December 31, 2025, 2024, and 2023, respectively. Cash and Cash Equivalents, Restricted Cash"
META_2025_META_Meta_2025_10K_2d479b16_fixed_256_fixed_0320,fixed_256,META,2025,Mixed,fixed,table_of_contents,"sheets because they represent investments of cash available for current operations. The AFS investments are carried at estimated fair value with any 96 Table of Contents unrealized gains and losses, net of taxes, included in accumulated oth"
META_2025_META_Meta_2025_10K_2d479b16_fixed_256_fixed_0323,fixed_256,META,2025,Mixed,fixed,table_of_contents,to measure fair value based on the lowest level of input that is available and significant to the fair value measurement: Level 1 - Quoted prices in active markets for identical assets or liabilities. Level 2 - Observable inputs other than 
META_2025_META_Meta_2025_10K_2d479b16_fixed_256_fixed_0326,fixed_256,META,2025,Mixed,fixed,table_of_contents,"consolidated statements of income. As of December 31, 2025 and 2024, the allowance for credit losses on accounts receivable were not material. Property and Equipment Property and equipment, including finance leases, are depreciated and stat"
META_2025_META_Meta_2025_10K_2d479b16_fixed_256_fixed_0327,fixed_256,META,2025,Mixed,fixed,table_of_contents,impairment loss is recognized in income from operations. The useful lives of our property and equipment are management's estimates when the assets are initially recognized and are routinely reviewed for the remaining estimated useful lives.
META_2025_META_Meta_2025_10K_2d479b16_fixed_256_fixed_0330,fixed_256,META,2025,Mixed,fixed,table_of_contents,"environment. Operating leases are included in operating lease ROU assets, operating lease liabilities, current, and operating lease liabilities, non-current on our consolidated balance sheets. Finance leases are included in property and equ"
META_2025_META_Meta_2025_10K_2d479b16_fixed_256_fixed_0331,fixed_256,META,2025,Mixed,fixed,table_of_contents,"legal or regulatory action. With respect to these matters, asserted and unasserted, we evaluate the associated developments on a regular basis and accrue a liability when we believe that it is both probable that a loss has been incurred and"
META_2025_META_Meta_2025_10K_2d479b16_fixed_256_fixed_0334,fixed_256,META,2025,Mixed,fixed,table_of_contents,"intangible asset prospectively over its estimated remaining useful life. We routinely review the remaining estimated useful lives of finite-lived intangible assets. If we change the estimated useful life assumption for any asset, the remain"
META_2025_META_Meta_2025_10K_2d479b16_fixed_256_fixed_0335,fixed_256,META,2025,Mixed,fixed,table_of_contents,"for the year ended December 31, 2025 and foreign currency transaction losses, net were $ 690 million, and $ 366 million for the years ended December 31, 2024 and 2023, respectively. 100 Table of Contents Credit Risk and Concentration Our fi"
META_2025_META_Meta_2025_10K_2d479b16_fixed_256_fixed_0338,fixed_256,META,2025,Mixed,fixed,table_of_contents,"with the year ending December 31, 2027 and for interim periods beginning January 1, 2028. Early adoption is permitted. Upon adoption, the guidance can be applied prospectively, retrospectively, or under a modified transition approach. We ar"
META_2025_META_Meta_2025_10K_2d479b16_fixed_256_fixed_0340,fixed_256,META,2025,Mixed,fixed,table_of_contents,"for the years ended December 31, 2025, 2024, and 2023, respectively. (2) Europe includes Russia and Turkey, and Rest of World includes Africa, Latin America, and the Middle East. Deferred revenue was $ 1.08 billion and $ 772 million as of D"
META_2025_META_Meta_2025_10K_2d479b16_fixed_256_fixed_0342,fixed_256,META,2025,Mixed,fixed,table_of_contents,"shares of Class B common stock, for the years ended December 31, 2025, 2024, and 2023, respectively. (2) The prior period EPS for Class A and Class B common stock has been presented together to conform with current period presentation, whic"
META_2025_META_Meta_2025_10K_2d479b16_fixed_256_fixed_0343,fixed_256,META,2025,Mixed,fixed,table_of_contents,"Description December 31, 2025 Quoted Prices in Active Markets for Identical Assets (Level 1) Significant Other Observable Inputs (Level 2) Significant Unobservable Inputs (Level 3) Cash equivalents: Money market funds $ 27,928 $ 27,928 $ — "
META_2025_META_Meta_2025_10K_2d479b16_fixed_256_fixed_0345,fixed_256,META,2025,Mixed,fixed,table_of_contents,"$ 3,129 $ ( 38 ) $ 5,850 $ ( 41 ) December 31, 2024 Less than 12 months 12 months or greater Total Fair Value Unrealized Losses Fair Value Unrealized Losses Fair Value Unrealized Losses U.S. government securities $ 6,860 $ ( 71 ) $ 4,330 $ "
META_2025_META_Meta_2025_10K_2d479b16_fixed_256_fixed_0347,fixed_256,META,2025,Mixed,fixed,table_of_contents,"data center campus in Louisiana (the Venture). This Venture provides strategic optionality and flexibility, enabling us to effectively meet future infrastructure capacity needs as AI markets and technologies develop. At Venture formation, w"
META_2025_META_Meta_2025_10K_2d479b16_fixed_256_fixed_0348,fixed_256,META,2025,Mixed,fixed,table_of_contents,"time. If we decide to terminate or not renew a lease, and if certain other conditions are met, our maximum RVG payment would equal any shortfall between the fair value at that time and the RVG threshold for that property. As of December 31,"
META_2025_META_Meta_2025_10K_2d479b16_fixed_256_fixed_0350,fixed_256,META,2025,Mixed,fixed,table_of_contents,"We extended the estimated useful lives of most servers and network assets to 5.5 years, effective January 1, 2025. See Note 1 — Summary of Significant Accounting Policies - Use of Estimates. During the years ended December 31, 2025, 2024, a"
META_2025_META_Meta_2025_10K_2d479b16_fixed_256_fixed_0351,fixed_256,META,2025,Mixed,fixed,table_of_contents,"million and $ 1.76 billion were recorded as impairment losses for operating lease right-of-use assets, respectively. Supplemental balance sheet information related to lease liabilities is as follows: December 31, 2025 2024 Weighted-average "
META_2025_META_Meta_2025_10K_2d479b16_fixed_256_fixed_0353,fixed_256,META,2025,Mixed,fixed,table_of_contents,"AI efforts, workforce, expected synergies, and potential monetization opportunities. The amount of goodwill generated that was deductible for tax purposes was not material. Acquisition-related costs were not material and were expensed as in"
META_2025_META_Meta_2025_10K_2d479b16_fixed_256_fixed_0355,fixed_256,META,2025,Mixed,fixed,table_of_contents,"771 2029 39 2030 27 Thereafter 37 Total $ 3,295 Note 9. Accrued Expenses and Other Current Liabilities The components of accrued expenses and other current liabilities are as follows (in millions): December 31, 2025 2024 Legal-related accru"
META_2025_META_Meta_2025_10K_2d479b16_fixed_256_fixed_0356,fixed_256,META,2025,Mixed,fixed,table_of_contents,"Notes 2028 - 2063 4.60 % - 5.75 % 4.68 % - 5.79 % 8,500 8,500 August 2024 Notes 2029 - 2064 4.30 % - 5.55 % 4.42 % - 5.60 % 10,500 10,500 November 2025 Notes 2030 - 2065 4.20 % - 5.75 % 4.27 % - 5.77 % 30,000 — Total face amount of long-ter"
META_2025_META_Meta_2025_10K_2d479b16_fixed_256_fixed_0357,fixed_256,META,2025,Mixed,fixed,table_of_contents,"end of the reporting periods and categorized as Level 2 in the fair value hierarchy. As of December 31, 2025, future principal payments for the Notes, by year, are as follows (in millions): 2026 $ — 2027 2,750 2028 1,500 2029 1,000 2030 5,0"
META_2025_META_Meta_2025_10K_2d479b16_fixed_256_fixed_0359,fixed_256,META,2025,Mixed,fixed,table_of_contents,"to asserted legal or regulatory action. With respect to these other legal proceedings, claims, regulatory, tax, or government inquiries and investigations, and other matters, asserted and unasserted, we evaluate the associated developments "
META_2025_META_Meta_2025_10K_2d479b16_fixed_256_fixed_0360,fixed_256,META,2025,Mixed,fixed,table_of_contents,"any such outcome becomes probable and estimable, could be materially adversely affected. For information regarding income tax contingencies, see Note 14 — Income Taxes. 112 Table of Contents Privacy and Related Matters Beginning on March 20"
META_2025_META_Meta_2025_10K_2d479b16_fixed_256_fixed_0365,fixed_256,META,2025,Mixed,fixed,table_of_contents,"On November 29, 2023, we separately filed a complaint, also in the U.S. District Court for the District of Columbia ( Meta Platforms, Inc. v. FTC ), asserting constitutional challenges to the structure of the FTC, and seeking to preliminari"
META_2025_META_Meta_2025_10K_2d479b16_fixed_256_fixed_0370,fixed_256,META,2025,Mixed,fixed,table_of_contents,"decision. In Flo Health , on August 1, 2025, a jury returned a verdict on liability in favor of the plaintiffs and on behalf of a California subclass on the sole claim remaining against Meta under Section 632 of the California Invasion of P"
META_2025_META_Meta_2025_10K_2d479b16_fixed_256_fixed_0375,fixed_256,META,2025,Mixed,fixed,table_of_contents,"relation to certain alleged business practices relating to Facebook Marketplace and imposed a fine of approximately EUR € 798 million. We appealed the European Commission's decision on January 28, 2025. In March 2024, the European Commissio"
META_2025_META_Meta_2025_10K_2d479b16_fixed_256_fixed_0376,fixed_256,META,2025,Mixed,fixed,table_of_contents,"European business and revenue. 115 Table of Contents Securities and Other Actions Beginning on March 20, 2018, multiple putative class actions and derivative actions were filed in state and federal courts in the United States and elsewhere "
META_2025_META_Meta_2025_10K_2d479b16_fixed_256_fixed_0380,fixed_256,META,2025,Mixed,fixed,table_of_contents,"and numerous school districts, municipalities, and tribal nations have filed public nuisance claims in the United States, Brazil, and/or Canada based on similar allegations. On October 6, 2022, the U.S. federal cases were centralized in the"
META_2025_META_Meta_2025_10K_2d479b16_fixed_256_fixed_0385,fixed_256,META,2025,Mixed,fixed,table_of_contents,"use of copyrighted books for generative AI model training. On June 25, 2025, the court granted our motion for summary judgment on fair use as to the named plaintiffs in the case. The parties will proceed to brief the remaining claim of copy"
META_2025_META_Meta_2025_10K_2d479b16_fixed_256_fixed_0388,fixed_256,META,2025,Mixed,fixed,table_of_contents,"addition, we have entered into indemnification agreements with our officers, directors, and certain employees, and our certificate of incorporation and bylaws contain similar indemnification obligations. It is not possible to determine the "
META_2025_META_Meta_2025_10K_2d479b16_fixed_256_fixed_0391,fixed_256,META,2025,Mixed,fixed,table_of_contents,"29, 2025 $ 0.525 $ 1,143 $ 180 $ 1,323 December 15, 2025 December 23, 2025 $ 0.525 $ 1,148 $ 180 $ 1,328 2024 February 22, 2024 March 26, 2024 $ 0.50 $ 1,099 $ 174 $ 1,273 June 14, 2024 June 26, 2024 $ 0.50 $ 1,093 $ 173 $ 1,266 September 1"
META_2025_META_Meta_2025_10K_2d479b16_fixed_256_fixed_0394,fixed_256,META,2025,Mixed,fixed,table_of_contents,"for the year ended December 31, 2025: Number of Shares Weighted-Average Grant Date Fair Value Per Share (in thousands) Unvested at December 31, 2024 122,632 $ 302.27 Granted 69,666 $ 661.57 Vested ( 61,906 ) $ 317.68 Forfeited ( 14,840 ) $ "
META_2025_META_Meta_2025_10K_2d479b16_fixed_256_fixed_0396,fixed_256,META,2025,Mixed,fixed,table_of_contents,"(OBBBA) enacted in July 2025, we expect to incur Corporate Alternative Minimum Tax (CAMT) beginning in 2025. We recorded a $ 15.93 billion charge in the third quarter of 2025, of which $ 14.03 billion was a valuation allowance against our U"
META_2025_META_Meta_2025_10K_2d479b16_fixed_256_fixed_0397,fixed_256,META,2025,Mixed,fixed,table_of_contents,"federal income tax effect (1) ( 202 ) ( 0.2 ) Foreign tax effects 1,464 1.7 Tax credits Research and development tax credits ( 3,912 ) ( 4.6 ) U.S. foreign tax credits ( 1,405 ) ( 1.6 ) Valuation allowances (2) 11,974 13.9 Changes in unreco"
META_2025_META_Meta_2025_10K_2d479b16_fixed_256_fixed_0398,fixed_256,META,2025,Mixed,fixed,table_of_contents,0.7 1.1 Share-based compensation ( 3.7 ) ( 0.6 ) Research and development tax credits ( 2.9 ) ( 1.5 ) Foreign-derived intangible income deduction ( 4.9 ) ( 4.3 ) Effect of non-U.S. operations 0.2 0.9 Other 1.4 1.0 Effective tax rate 11.8 % 
META_2025_META_Meta_2025_10K_2d479b16_fixed_256_fixed_0399,fixed_256,META,2025,Mixed,fixed,table_of_contents,"valuation allowance 12,195 23,537 Deferred tax liabilities: Depreciation and amortization ( 15,901 ) ( 10,959 ) Right-of-use assets ( 4,453 ) ( 3,000 ) Unrealized gains in securities and investments ( 621 ) — Other ( 387 ) — Total deferred "
META_2025_META_Meta_2025_10K_2d479b16_fixed_256_fixed_0400,fixed_256,META,2025,Mixed,fixed,table_of_contents,"credit carryforwards of $ 7.85 billion and $ 6.80 billion, respectively, most of which do not expire. 123 Table of Contents Utilization of our net operating loss and tax credit carryforwards may be subject to substantial annual limitations "
META_2025_META_Meta_2025_10K_2d479b16_fixed_256_fixed_0403,fixed_256,META,2025,Mixed,fixed,table_of_contents,"below. We did not agree with the position of the IRS and filed a petition in the Tax Court challenging the Notice ( Facebook, Inc. v. Comm'r of Internal Revenue (2010 tax year)). On January 15, 2020, the IRS' amendment to answer was filed s"
META_2025_META_Meta_2025_10K_2d479b16_fixed_256_fixed_0405,fixed_256,META,2025,Mixed,fixed,table_of_contents,in the 2017-2019 Notice relates to the same underlying transfer pricing transaction that we litigated in the 2010 tax year trial and for which we received a Tax Court opinion in May 2025. The IRS' proposed adjustments do not represent a fin
META_2025_META_Meta_2025_10K_2d479b16_fixed_256_fixed_0406,fixed_256,META,2025,Mixed,fixed,table_of_contents,"tax due, the assessed tax, interest, and penalties, if any, could have a material adverse impact on our financial position, results of operations, and cash flows. 125 Table of Contents Note 15. Segment and Geographical Information We report"
META_2025_META_Meta_2025_10K_2d479b16_fixed_256_fixed_0408,fixed_256,META,2025,Mixed,fixed,table_of_contents,"(1) ( 50,702 ) ( 41,327 ) ( 37,820 ) Other costs and expenses ( 66,988 ) ( 53,794 ) ( 50,331 ) Income from operations $ 83,276 $ 69,380 $ 46,751 ____________________________________ (1) Employee compensation includes employee payroll, share"
META_2025_META_Meta_2025_10K_2d479b16_fixed_256_fixed_0411,fixed_256,META,2025,Mixed,fixed,table_of_contents,"Financial Reporting In designing and evaluating the disclosure controls and procedures and internal control over financial reporting, management recognizes that any controls and procedures, no matter how well designed and operated, can prov"
META_2025_META_Meta_2025_10K_2d479b16_fixed_256_fixed_0412,fixed_256,META,2025,Mixed,fixed,table_of_contents,"provides for the sale of up to all of the net shares received during 2026 pursuant to Mr. Olivan's outstanding equity awards and any future equity award grants, as well as the sale of an aggregate of up to 43,333 shares of our Class A commo"
META_2025_META_Meta_2025_10K_2d479b16_fixed_256_fixed_0413,fixed_256,META,2025,Mixed,fixed,table_of_contents,"during 2026 pursuant to Ms. Li and her spouse's outstanding equity awards and any future equity award grants. The plan will terminate on November 24, 2026 , subject to early termination for certain specified events set forth in the plan. It"
META_2025_META_Meta_2025_10K_2d479b16_fixed_256_fixed_0414,fixed_256,META,2025,Mixed,fixed,table_of_contents,"company, that we believe are reasonably designed to promote compliance with insider trading laws, rules and regulations, and the Nasdaq Stock Market LLC listing standards. Our insider trading policy and our 10b5-1 trading plan policy are fi"
META_2025_META_Meta_2025_10K_2d479b16_fixed_256_fixed_0415,fixed_256,META,2025,Mixed,fixed,table_of_contents,2025. Item 14. Principal Accountant Fees and Services The information required by this item is incorporated by reference to our Proxy Statement for the 2026 Annual Meeting of Stockholders to be filed with the SEC within 120 days of the fisc
META_2025_META_Meta_2025_10K_2d479b16_fixed_256_fixed_0416,fixed_256,META,2025,Mixed,fixed,table_of_contents,"Restated Bylaws. 8-K 001-35551 3.1 September 10, 2024 4.1 Form of Class A Common Stock Certificate. 10-K 001-35551 4.1 February 3, 2022 4.2 Form of Class B Common Stock Certificate. 10-K 001-35551 4.2 February 3, 2022 4.3 Indenture, dated a"
META_2025_META_Meta_2025_10K_2d479b16_fixed_256_fixed_0418,fixed_256,META,2025,Mixed,fixed,table_of_contents,"and Restated Bonus Plan, effective January 1, 2025. 10-Q 001-35551 10.1 May 1, 2025 10.4+ Amended and Restated Bonus Plan, effective January 1, 202 6 . X 10.5+ Amended and Restated Offer Letter, dated January 27, 2012, between Registrant an"
META_2025_META_Meta_2025_10K_2d479b16_fixed_256_fixed_0419,fixed_256,META,2025,Mixed,fixed,table_of_contents,"27, 2024, between Registrant and Mark Zuckerberg. 10-Q 001-35551 10.1 April 25, 2024 131 Table of Contents Exhibit Incorporated by Reference Filed Herewith Number Exhibit Description Form File No. Exhibit Filing Date 10.15+* Form of Directo"
META_2025_META_Meta_2025_10K_2d479b16_fixed_256_fixed_0420,fixed_256,META,2025,Mixed,fixed,table_of_contents,"February 2, 2024 101.INS Inline XBRL Instance Document (the instance document does not appear in the Interactive Data File because its XBRL tags are embedded within the Inline XBRL document). X 101.SCH Inline XBRL Taxonomy Extension Schema "
META_2025_META_Meta_2025_10K_2d479b16_fixed_256_fixed_0421,fixed_256,META,2025,Mixed,fixed,table_of_contents,"Securities Exchange Act of 1934, the registrant has duly caused this Annual Report on Form 10-K to be signed on its behalf by the undersigned, thereunto duly authorized, in the City of Menlo Park, State of California, on this 28th day of Ja"
META_2025_META_Meta_2025_10K_2d479b16_fixed_256_fixed_0422,fixed_256,META,2025,Mixed,fixed,table_of_contents,"connection therewith, as fully to all intents and purposes as he or she might or could do in person, hereby ratifying and confirming that all said attorneys-in-fact and agents, or any of them or their or his or her substitute or substitutes"
META_2025_META_Meta_2025_10K_2d479b16_fixed_256_fixed_0423,fixed_256,META,2025,Mixed,fixed,table_of_contents,"January 28, 2026 Andrew W. Houston /s/ Nancy Killefer Director January 28, 2026 Nancy Killefer /s/ Robert M. Kimmitt Director January 28, 2026 Robert M. Kimmitt /s/ Charles Songhurst Director January 28, 2026 Charles Songhurst 134 Table of "
MSFT_2025_MSFT_Microsoft_2025_10K_cd44566e_fixed_256_fixed_0012,fixed_256,MSFT,2025,Mixed,fixed,table_of_contents,"shell company (as defined in Rule 12b-2 of the Act). Yes ☐ No ☒ As of December 31, 2024, the aggregate market value of the registrant’s common stock held by non-affiliates of the registrant was $ 3.1 trillion based on the closing sale price"
MSFT_2025_MSFT_Microsoft_2025_10K_cd44566e_fixed_256_fixed_0013,fixed_256,MSFT,2025,Mixed,fixed,table_of_contents,of Operations 35 Item 7A. Quantitative and Qualitative Disclosures About Market Risk 49 Item 8. Financial Statements and Supplementary Data 50 Item 9. Changes in and Disagreements with Accountants on Accounting and Financial Disclosure 89 I
