chunk_id,chunk_config,ticker,year,section_id,source_type,non_retrievable_reason,text_preview
AAPL_2025_AAPL_Apple_2025_10K_39055237_fixed_256_fixed_0001,fixed_256,AAPL,2025,Mixed,fixed,header_footer,Notes due 2029 — The Nasdaq Stock Market LLC 0.500% Notes due 2031 — The Nasdaq Stock Market LLC 3.600% Notes due 2042 — The Nasdaq Stock Market LLC Securities registered pursuant to Section 12(g) of the Act: None Indicate by check mark if 
AAPL_2025_AAPL_Apple_2025_10K_39055237_fixed_256_fixed_0003,fixed_256,AAPL,2025,Mixed,fixed,header_footer,mark whether the financial statements of the registrant included in the filing reflect the correction of an error to previously issued financial statements. ☐ Indicate by check mark whether any of those error corrections are restatements th
AAPL_2025_AAPL_Apple_2025_10K_39055237_fixed_256_fixed_0004,fixed_256,AAPL,2025,Mixed,fixed,header_footer,REFERENCE Portions of the Registrant’s definitive proxy statement relating to its 2026 annual meeting of shareholders are incorporated by reference into Part III of this Annual Report on Form 10-K where indicated. The Registrant’s definitiv
AAPL_2025_AAPL_Apple_2025_10K_39055237_fixed_256_fixed_0005,fixed_256,AAPL,2025,Mixed,fixed,header_footer,"Other Information 53 Item 9C. Disclosure Regarding Foreign Jurisdictions that Prevent Inspections 53 Part III Item 10. Directors, Executive Officers and Corporate Governance 53 Item 11. Executive Compensation 53 Item 12 . Security Ownership"
AAPL_2025_AAPL_Apple_2025_10K_39055237_fixed_256_fixed_0006,fixed_256,AAPL,2025,Mixed,fixed,forward_looking_boilerplate,"of macroeconomic conditions and tariffs and other measures on the Company’s business and results of operations are forwardlooking statements. Forward-looking statements can also be identified by words such as “future,” “anticipates,” “belie"
AAPL_2025_AAPL_Apple_2025_10K_39055237_fixed_256_fixed_0008,fixed_256,AAPL,2025,Mixed,fixed,header_footer,"® 3. The Company’s line of wireless headphones includes AirPods ® , AirPods Pro ® , AirPods Max ® and Beats ® products. Apple Vision Pro™ is the Company’s spatial computer based on its visionOS ® operating system. Home includes Apple TV 4K "
AAPL_2025_AAPL_Apple_2025_10K_39055237_fixed_256_fixed_0011,fixed_256,AAPL,2025,Mixed,fixed,header_footer,"businesses. The markets in which the Company competes are further defined by frequent introduction of new products and services, short product life cycles, evolving industry standards, and rapid adoption of technological advancements by com"
AAPL_2025_AAPL_Apple_2025_10K_39055237_fixed_256_fixed_0015,fixed_256,AAPL,2025,Mixed,fixed,header_footer,and other forms of intellectual property rights in the U.S. and various foreign countries. Although the Company believes the ownership of such intellectual property rights is an important factor in differentiating its business and that its 
AAPL_2025_AAPL_Apple_2025_10K_39055237_fixed_256_fixed_0019,fixed_256,AAPL,2025,Mixed,fixed,header_footer,"www.apple.com, and its investor relations website, investor.apple.com. This includes press releases and other information about financial performance, information on corporate governance, and details related to the Company’s annual meeting "
AAPL_2025_AAPL_Apple_2025_10K_39055237_fixed_256_fixed_0021,fixed_256,AAPL,2025,Mixed,fixed,header_footer,"changes in fiscal and monetary policy, financial market volatility, declines in income or asset values, and other economic factors. Uncertainty about, or a decline in, global or regional economic conditions can also have a significant impac"
AAPL_2025_AAPL_Apple_2025_10K_39055237_fixed_256_fixed_0026,fixed_256,AAPL,2025,Mixed,fixed,header_footer,"serious injuries or loss of life, disruption to the Company’s business, and harm to the Company’s reputation. Major public health issues, including pandemics such as the COVID-19 pandemic, have adversely affected, and could in the future ma"
AAPL_2025_AAPL_Apple_2025_10K_39055237_fixed_256_fixed_0029,fixed_256,AAPL,2025,Mixed,fixed,header_footer,"is unable to continue to develop and sell innovative new products with attractive margins or if competitors infringe on the Company’s intellectual property, the Company’s ability to maintain a competitive advantage could be materially adver"
AAPL_2025_AAPL_Apple_2025_10K_39055237_fixed_256_fixed_0030,fixed_256,AAPL,2025,Mixed,fixed,header_footer,"and some of the markets in which the Company competes have from time to time experienced little to no growth or contracted overall. If the Company is unable to compete successfully, its business, reputation, results of operations, financial"
AAPL_2025_AAPL_Apple_2025_10K_39055237_fixed_256_fixed_0034,fixed_256,AAPL,2025,Mixed,fixed,header_footer,"utilize custom components available from only one source. When a component or product uses new technologies, initial capacity constraints may exist until the suppliers’ yields have matured or their manufacturing capacities have increased. T"
AAPL_2025_AAPL_Apple_2025_10K_39055237_fixed_256_fixed_0038,fixed_256,AAPL,2025,Mixed,fixed,header_footer,"changes in the industries in which the Company currently competes or in the future may compete, current extensive intellectual property coverage and the rapid rate of new intellectual property rights generation, the Company’s products and s"
AAPL_2025_AAPL_Apple_2025_10K_39055237_fixed_256_fixed_0039,fixed_256,AAPL,2025,Mixed,fixed,header_footer,"adversely affect the Company’s business, reputation, results of operations, financial condition and stock price. Apple Inc. | 2025 Form 10-K | 9 /mnt/data/Apple2025_10K.html The Company’s future performance depends in part on support from t"
AAPL_2025_AAPL_Apple_2025_10K_39055237_fixed_256_fixed_0043,fixed_256,AAPL,2025,Mixed,fixed,header_footer,"not effectively manage changing workforce dynamics and regulatory requirements, it could materially adversely affect the Company’s culture, operational flexibility, strategy and costs, all of which can materially adversely affect the Compan"
AAPL_2025_AAPL_Apple_2025_10K_39055237_fixed_256_fixed_0047,fixed_256,AAPL,2025,Mixed,fixed,header_footer,"detection, and remove or obfuscate forensic evidence, all of which hinders the Company’s ability to identify, investigate and recover from incidents. In addition, attacks against the Company and its customers can escalate during periods of "
AAPL_2025_AAPL_Apple_2025_10K_39055237_fixed_256_fixed_0051,fixed_256,AAPL,2025,Mixed,fixed,header_footer,"In recognition of these considerations, the Company may enter into agreements or other arrangements to settle litigation and resolve such challenges. However, such agreements may not always be available on acceptable terms, and litigation m"
AAPL_2025_AAPL_Apple_2025_10K_39055237_fixed_256_fixed_0055,fixed_256,AAPL,2025,Mixed,fixed,header_footer,"social and other issues related to the Company’s business. The Company makes statements about its values, including the environmental and societal impact of its business, through various reports, information provided on the Company’s websit"
AAPL_2025_AAPL_Apple_2025_10K_39055237_fixed_256_fixed_0060,fixed_256,AAPL,2025,Mixed,fixed,header_footer,laws and regulations in the future. Changes to the Company’s business practices to comply with new laws and regulations or in connection with legal proceedings can negatively impact the reputation of the Company’s products for privacy and s
AAPL_2025_AAPL_Apple_2025_10K_39055237_fixed_256_fixed_0064,fixed_256,AAPL,2025,Mixed,fixed,header_footer,"overall magnitude and duration, and retaliatory actions in response; and the introduction of new products or services, including new products or services with lower profit margins. These and other factors could have a materially adverse imp"
AAPL_2025_AAPL_Apple_2025_10K_39055237_fixed_256_fixed_0065,fixed_256,AAPL,2025,Mixed,fixed,header_footer,"to raise international pricing, potentially reducing demand for the Company’s products. In some circumstances, for competitive or other reasons, the Company may decide not to raise international pricing to offset the U.S. dollar’s strengthe"
AAPL_2025_AAPL_Apple_2025_10K_39055237_fixed_256_fixed_0068,fixed_256,AAPL,2025,Mixed,fixed,header_footer,"Singapore, where a number of the Company’s subsidiaries are organized. Due to economic and political conditions, tax laws and tax rates for income taxes and other non-income taxes in various jurisdictions may be subject to significant chang"
AAPL_2025_AAPL_Apple_2025_10K_39055237_fixed_256_fixed_0069,fixed_256,AAPL,2025,Mixed,fixed,header_footer,"increase, or if the ultimate determination of the Company’s taxes owed is for an amount in excess of amounts previously accrued, the Company’s business, results of operations, financial condition and stock price could be materially adversel"
AAPL_2025_AAPL_Apple_2025_10K_39055237_fixed_256_fixed_0072,fixed_256,AAPL,2025,Mixed,fixed,header_footer,"Compliance and Business Conduct, Business Assurance, and Internal Audit, and receives updates, as necessary, regarding cybersecurity incidents. The Chair of the Audit Committee regularly reports the substance of such reviews and discussions"
AAPL_2025_AAPL_Apple_2025_10K_39055237_fixed_256_fixed_0076,fixed_256,AAPL,2025,Mixed,fixed,header_footer,in or out of an app. The California District Court also denied the Company’s motion to narrow or vacate the 2021 Injunction and referred the Company to the U.S. Attorney for the Northern District of California for a determination whether cr
AAPL_2025_AAPL_Apple_2025_10K_39055237_fixed_256_fixed_0077,fixed_256,AAPL,2025,Mixed,fixed,header_footer,"a reporting period for amounts above management’s expectations, the Company’s financial condition and operating results for that reporting period could be materially adversely affected. Item 4. Mine Safety Disclosures Not applicable. Apple "
AAPL_2025_AAPL_Apple_2025_10K_39055237_fixed_256_fixed_0078,fixed_256,AAPL,2025,Mixed,fixed,header_footer,"negotiated purchases 28,986 $ 224.25 28,986 August 31, 2025 to September 27, 2025: Open market and privately negotiated purchases 27,247 $ 238.56 27,247 Total 89,498 $ 99,779 (1) On May 2, 2024, the Company announced a program to repurchase"
AAPL_2025_AAPL_Apple_2025_10K_39055237_fixed_256_fixed_0079,fixed_256,AAPL,2025,Mixed,fixed,header_footer,"invested in each of the Company’s common stock, the S&P 500 Index and the Dow Jones U.S. Technology Total Stock Market Index as of the market close on September 25, 2020. Past stock price performance is not necessarily indicative of future "
AAPL_2025_AAPL_Apple_2025_10K_39055237_fixed_256_fixed_0081,fixed_256,AAPL,2025,Mixed,fixed,header_footer,"fiscal year is the 52- or 53-week period that ends on the last Saturday of September. An additional week is included in the first fiscal quarter every five or six years to realign the Company’s fiscal quarters with calendar quarters, which "
AAPL_2025_AAPL_Apple_2025_10K_39055237_fixed_256_fixed_0083,fixed_256,AAPL,2025,Mixed,fixed,header_footer,"net sales by reportable segment for 2025, 2024 and 2023 (dollars in millions): 2025 Change 2024 Change 2023 Americas $ 178,353 7 % $ 167,045 3 % $ 162,560 Europe 111,032 10 % 101,328 7 % 94,294 Greater China 64,377 (4) % 66,952 (8) % 72,559"
AAPL_2025_AAPL_Apple_2025_10K_39055237_fixed_256_fixed_0084,fixed_256,AAPL,2025,Mixed,fixed,header_footer,"Pacific Rest of Asia Pacific net sales increased during 2025 compared to 2024 primarily due to higher net sales of iPhone, Services and Mac. Apple Inc. | 2025 Form 10-K | 22 /mnt/data/Apple2025_10K.html Products and Services Performance The"
AAPL_2025_AAPL_Apple_2025_10K_39055237_fixed_256_fixed_0085,fixed_256,AAPL,2025,Mixed,fixed,header_footer,"of iPad Air, iPad mini and iPad, partially offset by lower net sales of iPad Pro. Wearables, Home and Accessories Wearables, Home and Accessories net sales decreased during 2025 compared to 2024 primarily due to lower net sales of Accessori"
AAPL_2025_AAPL_Apple_2025_10K_39055237_fixed_256_fixed_0086,fixed_256,AAPL,2025,Mixed,fixed,header_footer,other favorable costs. Services Gross Margin Services gross margin increased during 2025 compared to 2024 primarily due to higher Services net sales and a different mix of services. Services gross margin percentage increased during 2025 com
AAPL_2025_AAPL_Apple_2025_10K_39055237_fixed_256_fixed_0087,fixed_256,AAPL,2025,Mixed,fixed,header_footer,"compared to 2024 was primarily driven by increases in headcount-related expenses and infrastructure-related costs. Selling, General and Administrative The growth in selling, general and administrative expense during 2025 compared to 2024 wa"
AAPL_2025_AAPL_Apple_2025_10K_39055237_fixed_256_fixed_0089,fixed_256,AAPL,2025,Mixed,fixed,header_footer,"the Company had $8.0 billion of commercial paper outstanding, which was payable within 12 months. Leases The Company has lease arrangements for certain equipment and facilities, including corporate, data center, manufacturing and retail spa"
AAPL_2025_AAPL_Apple_2025_10K_39055237_fixed_256_fixed_0090,fixed_256,AAPL,2025,Mixed,fixed,header_footer,"repatriation tax payable imposed by the U.S. Tax Cuts and Jobs Act of 2017 (“TCJA”) was $8.8 billion, which was payable within 12 months. Apple Inc. | 2025 Form 10-K | 25 /mnt/data/Apple2025_10K.html Capital Return Program In addition to it"
AAPL_2025_AAPL_Apple_2025_10K_39055237_fixed_256_fixed_0093,fixed_256,AAPL,2025,Mixed,fixed,header_footer,"used in the preparation of the Company’s consolidated financial statements. Management bases its estimates on historical experience and on various other assumptions it believes to be reasonable under the circumstances, the results of which "
AAPL_2025_AAPL_Apple_2025_10K_39055237_fixed_256_fixed_0096,fixed_256,AAPL,2025,Mixed,fixed,header_footer,"hedge certain foreign currency exposures for a variety of reasons, including accounting considerations or prohibitive cost. The Company applied a value-at-risk (“VAR”) model to its foreign currency derivative positions to assess the potenti"
AAPL_2025_AAPL_Apple_2025_10K_39055237_fixed_256_fixed_0097,fixed_256,AAPL,2025,Mixed,fixed,header_footer,"28, 2024 and September 30, 2023 30 Consolidated Balance Sheets as of September 27, 2025 and September 28, 2024 31 Consolidated Statements of Shareholders’ Equity for the years ended September 27, 2025, September 28, 2024 and September 30, 2"
AAPL_2025_AAPL_Apple_2025_10K_39055237_fixed_256_fixed_0098,fixed_256,AAPL,2025,Mixed,fixed,header_footer,"214,137 Gross margin 195,201 180,683 169,148 Operating expenses: Research and development 34,550 31,370 29,915 Selling, general and administrative 27,601 26,097 24,932 Total operating expenses 62,151 57,467 54,847 Operating income 133,050 1"
AAPL_2025_AAPL_Apple_2025_10K_39055237_fixed_256_fixed_0099,fixed_256,AAPL,2025,Mixed,fixed,header_footer,"instruments 637 (2,169) (1,394) Change in unrealized gains/losses on marketable debt securities, net of tax: Change in fair value of marketable debt securities 817 5,850 1,563 Adjustment for net (gains)/losses realized and included in net i"
AAPL_2025_AAPL_Apple_2025_10K_39055237_fixed_256_fixed_0100,fixed_256,AAPL,2025,Mixed,fixed,header_footer,"Deferred revenue 9,055 8,249 Commercial paper 7,979 9,967 Term debt 12,350 10,912 Total current liabilities 165,631 176,392 Non-current liabilities: Term debt 78,328 85,750 Other non-current liabilities 41,549 45,888 Total non-current liabi"
AAPL_2025_AAPL_Apple_2025_10K_39055237_fixed_256_fixed_0101,fixed_256,AAPL,2025,Mixed,fixed,header_footer,"and dividend equivalents declared (15,413) (15,218) (14,996) Common stock withheld related to net share settlement of equity awards (1,655) (1,612) (2,099) Common stock repurchased (90,052) (95,846) (77,046) Ending balances (14,264) (19,154"
AAPL_2025_AAPL_Apple_2025_10K_39055237_fixed_256_fixed_0102,fixed_256,AAPL,2025,Mixed,fixed,header_footer,"(9,197) (11,731) (5,684) Accounts payable 902 6,020 (1,889) Other current and non-current liabilities (11,076) 15,552 3,031 Cash generated by operating activities 111,482 118,254 110,543 Investing activities: Purchases of marketable securit"
AAPL_2025_AAPL_Apple_2025_10K_39055237_fixed_256_fixed_0103,fixed_256,AAPL,2025,Mixed,fixed,header_footer,accompanying Notes to Consolidated Financial Statements. Apple Inc. | 2025 Form 10-K | 33 /mnt/data/Apple2025_10K.html Apple Inc. Notes to Consolidated Financial Statements Note 1 – Summary of Significant Accounting Policies Basis of Presen
AAPL_2025_AAPL_Apple_2025_10K_39055237_fixed_256_fixed_0104,fixed_256,AAPL,2025,Mixed,fixed,header_footer,"Adopted Accounting Pronouncements Segment Reporting Beginning with the 2025 annual reporting period, the Company adopted the FASB’s ASU No. 2023-07, Segment Reporting (Topic 280): Improvements to Reportable Segment Disclosures (“ASU 2023-07"
AAPL_2025_AAPL_Apple_2025_10K_39055237_fixed_256_fixed_0105,fixed_256,AAPL,2025,Mixed,fixed,header_footer,"method. Property, Plant and Equipment Property, plant and equipment are stated at cost. Depreciation on property, plant and equipment is recognized on a straight-line basis. Apple Inc. | 2025 Form 10-K | 34 /mnt/data/Apple2025_10K.html Deri"
AAPL_2025_AAPL_Apple_2025_10K_39055237_fixed_256_fixed_0108,fixed_256,AAPL,2025,Mixed,fixed,header_footer,"unbilled consideration relates entirely to the value of the undelivered services. Accordingly, the Company has not recognized revenue, and does not disclose amounts, related to these undelivered services. For the sale of third-party product"
AAPL_2025_AAPL_Apple_2025_10K_39055237_fixed_256_fixed_0110,fixed_256,AAPL,2025,Mixed,fixed,header_footer,"and diluted earnings per share for 2025, 2024 and 2023 (net income in millions and shares in thousands): 2025 2024 2023 Numerator: Net income $ 112,010 $ 93,736 $ 96,995 Denominator: Weighted-average basic shares outstanding 14,948,500 15,3"
AAPL_2025_AAPL_Apple_2025_10K_39055237_fixed_256_fixed_0112,fixed_256,AAPL,2025,Mixed,fixed,header_footer,"U.S. Treasury securities 16,150 45 (516) 15,679 212 4,087 11,380 U.S. agency securities 5,431 — (272) 5,159 155 703 4,301 Non-U.S. government securities 17,959 93 (484) 17,568 1,158 10,810 5,600 Certificates of deposit and time deposits 873"
AAPL_2025_AAPL_Apple_2025_10K_39055237_fixed_256_fixed_0113,fixed_256,AAPL,2025,Mixed,fixed,header_footer,"to Note 7, “Income Taxes”). (3) As of September 28, 2024, current marketable securities included $13.2 billion held in escrow and restricted from general use. These restricted marketable securities were designated to settle the Company’s ob"
AAPL_2025_AAPL_Apple_2025_10K_39055237_fixed_256_fixed_0116,fixed_256,AAPL,2025,Mixed,fixed,header_footer,"or fair value hedges. As of September 27, 2025, the maximum length of time over which the Company is hedging its exposure to the variability in future cash flows for term debt–related foreign currency transactions is 17 years. The Company m"
AAPL_2025_AAPL_Apple_2025_10K_39055237_fixed_256_fixed_0118,fixed_256,AAPL,2025,Mixed,fixed,header_footer,"2025, the Company had two vendors that individually represented 10% or more of total vendor non-trade receivables, which accounted for 46% and 23%. As of September 28, 2024, the Company had two vendors that individually represented 10% or m"
AAPL_2025_AAPL_Apple_2025_10K_39055237_fixed_256_fixed_0120,fixed_256,AAPL,2025,Mixed,fixed,header_footer,"to the European Court of Justice (“ECJ”). On September 10, 2024, the ECJ announced that it had set aside the 2020 judgment of the General Court and confirmed the Commission’s 2016 State Aid Decision. As a result, during the fourth quarter o"
AAPL_2025_AAPL_Apple_2025_10K_39055237_fixed_256_fixed_0121,fixed_256,AAPL,2025,Mixed,fixed,header_footer,"| 40 /mnt/data/Apple2025_10K.html A reconciliation of the provision for income taxes to the amount computed by applying the statutory federal income tax rate (21% in 2025, 2024 and 2023) to income before provision for income taxes for 2025,"
AAPL_2025_AAPL_Apple_2025_10K_39055237_fixed_256_fixed_0122,fixed_256,AAPL,2025,Mixed,fixed,header_footer,"27,451 26,007 Deferred tax liabilities: Depreciation 3,276 2,551 Right-of-use assets 2,300 2,125 Minimum tax on foreign earnings 1,217 1,674 Other 678 455 Total deferred tax liabilities 7,471 6,805 Net deferred tax assets $ 19,980 $ 19,202 "
AAPL_2025_AAPL_Apple_2025_10K_39055237_fixed_256_fixed_0124,fixed_256,AAPL,2025,Mixed,fixed,header_footer,"of which are reasonably certain of exercise. Payments under the Company’s lease arrangements may be fixed or variable, and variable lease payments are primarily based on purchases of output of the underlying leased assets. Lease costs assoc"
AAPL_2025_AAPL_Apple_2025_10K_39055237_fixed_256_fixed_0125,fixed_256,AAPL,2025,Mixed,fixed,header_footer,"12,238 $ 11,303 Lease liabilities: Operating leases Other current liabilities $ 1,579 $ 1,488 Other non-current liabilities 10,911 10,046 Finance leases Other current liabilities 538 144 Other non-current liabilities 692 752 Total lease lia"
AAPL_2025_AAPL_Apple_2025_10K_39055237_fixed_256_fixed_0126,fixed_256,AAPL,2025,Mixed,fixed,header_footer,"cannot be readily determined. As of September 27, 2025, the Company had $523 million of fixed payment obligations under additional leases, primarily for corporate facilities and retail space, that had not yet commenced. These leases are exp"
AAPL_2025_AAPL_Apple_2025_10K_39055237_fixed_256_fixed_0127,fixed_256,AAPL,2025,Mixed,fixed,header_footer,"5,836 — — Repayments of commercial paper (2,048) — (2,645) Proceeds from/(Repayments of) commercial paper, net 3,788 — (2,645) Total proceeds from/(repayments of) commercial paper, net $ (2,032) $ 3,960 $ (3,978) Apple Inc. | 2025 Form 10-K"
AAPL_2025_AAPL_Apple_2025_10K_39055237_fixed_256_fixed_0128,fixed_256,AAPL,2025,Mixed,fixed,header_footer,"Company uses interest rate swaps to effectively convert the fixed interest rates to floating interest rates on a portion of these notes. Additionally, to manage foreign exchange rate risk on certain of its foreign currency–denominated notes"
AAPL_2025_AAPL_Apple_2025_10K_39055237_fixed_256_fixed_0129,fixed_256,AAPL,2025,Mixed,fixed,header_footer,"open market transactions, including under plans complying with Rule 10b5-1 under the Exchange Act. Apple Inc. | 2025 Form 10-K | 44 /mnt/data/Apple2025_10K.html Shares of Common Stock The following table shows the changes in shares of commo"
AAPL_2025_AAPL_Apple_2025_10K_39055237_fixed_256_fixed_0131,fixed_256,AAPL,2025,Mixed,fixed,header_footer,appropriate taxing authorities. Total payments to taxing authorities for employees’ tax obligations were $6.1 billion in 2025 and $5.6 billion in both 2024 and 2023. Share-Based Compensation The following table shows share-based compensatio
AAPL_2025_AAPL_Apple_2025_10K_39055237_fixed_256_fixed_0133,fixed_256,AAPL,2025,Mixed,fixed,header_footer,"components and rare earths and other raw materials that go into them. The Company uses some custom components that are not commonly used by its competitors, and new products introduced by the Company often utilize custom components availabl"
AAPL_2025_AAPL_Apple_2025_10K_39055237_fixed_256_fixed_0134,fixed_256,AAPL,2025,Mixed,fixed,header_footer,"partners that are located primarily in China mainland, India, Japan, South Korea, Taiwan and Vietnam. Apple Inc. | 2025 Form 10-K | 46 /mnt/data/Apple2025_10K.html Note 13 – Segment Information and Geographic Data The Company manages its bu"
AAPL_2025_AAPL_Apple_2025_10K_39055237_fixed_256_fixed_0136,fixed_256,AAPL,2025,Mixed,fixed,header_footer,"sales (89,587) (55,197) (37,519) (11,744) (16,305) — (210,352) Research and development — — — — — (31,370) (31,370) Selling and marketing (9,802) (4,341) (2,351) (854) (1,291) — (18,639) General and administrative — — — — — (7,458) (7,458) "
AAPL_2025_AAPL_Apple_2025_10K_39055237_fixed_256_fixed_0137,fixed_256,AAPL,2025,Mixed,fixed,header_footer,"(in millions): 2025 2024 2023 Net sales: U.S. $ 151,790 $ 142,196 $ 138,573 China (1) 64,377 66,952 72,559 Other countries 199,994 181,887 172,153 Total net sales $ 416,161 $ 391,035 $ 383,285 2025 2024 Long-lived assets: U.S. $ 40,274 $ 35"
AAPL_2025_AAPL_Apple_2025_10K_39055237_fixed_256_fixed_0140,fixed_256,AAPL,2025,Mixed,fixed,header_footer,"opinion on the critical audit matter or on the account or disclosure to which it relates. Uncertain Tax Positions Description of the Matter As discussed in Note 7 to the financial statements, the Company is subject to income taxes in the U."
AAPL_2025_AAPL_Apple_2025_10K_39055237_fixed_256_fixed_0141,fixed_256,AAPL,2025,Mixed,fixed,header_footer,"to measure the benefit of its tax positions that qualify for recognition, and the related disclosures. We evaluated the Company’s assessment of which tax positions are more likely than not to be sustained and the related measurement of the "
AAPL_2025_AAPL_Apple_2025_10K_39055237_fixed_256_fixed_0144,fixed_256,AAPL,2025,Mixed,fixed,header_footer,"external purposes in accordance with generally accepted accounting principles. A company’s internal control over financial reporting includes those policies and procedures that (1) pertain to the maintenance of records that, in reasonable d"
AAPL_2025_AAPL_Apple_2025_10K_39055237_fixed_256_fixed_0145,fixed_256,AAPL,2025,Mixed,fixed,header_footer,Form 10-K | 51 /mnt/data/Apple2025_10K.html Item 9. Changes in and Disagreements with Accountants on Accounting and Financial Disclosure None. Item 9A. Controls and Procedures Evaluation of Disclosure Controls and Procedures Based on an eva
